{
    "$schema":  "../component.schema.json",
    "name":  "app-shell",
    "type":  "registry:ui",
    "title":  "App Shell",
    "description":  "A reusable App Shell component for SolidJS applications.",
    "files":  [
                  {
                      "path":  "packages/ui/src/components/app-shell/app-shell.scss",
                      "type":  "style"
                  },
                  {
                      "path":  "packages/ui/src/components/app-shell/AppShell.tsx",
                      "type":  "component"
                  },
                  {
                      "path":  "packages/ui/src/components/app-shell/index.ts",
                      "type":  "barrel"
                  }
              ],
    "dependencies":  [
                         "@solidcx/cx"
                     ],
    "registryDependencies":  [
                                 "sidebar"
                             ],
    "cssDependencies":  [
                            "@solidcx/styles"
                        ]
}