{
    "$schema":  "../component.schema.json",
    "name":  "hovercard",
    "type":  "registry:ui",
    "title":  "Hovercard",
    "description":  "A reusable Hovercard component for SolidJS applications.",
    "files":  [
                  {
                      "path":  "packages/ui/src/components/hovercard/hover-card.scss",
                      "type":  "style"
                  },
                  {
                      "path":  "packages/ui/src/components/hovercard/HoverCard.tsx",
                      "type":  "component"
                  },
                  {
                      "path":  "packages/ui/src/components/hovercard/index.ts",
                      "type":  "barrel"
                  }
              ],
    "dependencies":  [
                         "@solidcx/cx"
                     ],
    "registryDependencies":  [

                             ],
    "cssDependencies":  [
                            "@solidcx/styles"
                        ]
}