{
    "$schema":  "../component.schema.json",
    "name":  "combobox",
    "type":  "registry:ui",
    "title":  "Combobox",
    "description":  "A reusable Combobox component for SolidJS applications.",
    "files":  [
                  {
                      "path":  "packages/ui/src/components/combobox/combobox.scss",
                      "type":  "style"
                  },
                  {
                      "path":  "packages/ui/src/components/combobox/Combobox.tsx",
                      "type":  "component"
                  },
                  {
                      "path":  "packages/ui/src/components/combobox/index.ts",
                      "type":  "barrel"
                  }
              ],
    "dependencies":  [
                         "@solidcx/cx",
                         "lucide-solid"
                     ],
    "registryDependencies":  [

                             ],
    "cssDependencies":  [
                            "@solidcx/styles"
                        ]
}