{
    "$schema":  "../component.schema.json",
    "name":  "alert",
    "type":  "registry:ui",
    "title":  "Alert",
    "description":  "A reusable Alert component for SolidJS applications.",
    "files":  [
                  {
                      "path":  "packages/ui/src/components/alert/alert.scss",
                      "type":  "style"
                  },
                  {
                      "path":  "packages/ui/src/components/alert/Alert.tsx",
                      "type":  "component"
                  },
                  {
                      "path":  "packages/ui/src/components/alert/index.ts",
                      "type":  "barrel"
                  }
              ],
    "dependencies":  [
                         "@solidcx/cx"
                     ],
    "registryDependencies":  [

                             ],
    "cssDependencies":  [
                            "@solidcx/styles"
                        ]
}