{
    "$schema":  "../component.schema.json",
    "name":  "date-field",
    "type":  "registry:ui",
    "title":  "Date Field",
    "description":  "A reusable Date Field component for SolidJS applications.",
    "files":  [
                  {
                      "path":  "packages/ui/src/components/date-field/date-field.scss",
                      "type":  "style"
                  },
                  {
                      "path":  "packages/ui/src/components/date-field/Datefield.tsx",
                      "type":  "component"
                  },
                  {
                      "path":  "packages/ui/src/components/date-field/index.ts",
                      "type":  "barrel"
                  }
              ],
    "dependencies":  [
                         "@solidcx/cx"
                     ],
    "registryDependencies":  [

                             ],
    "cssDependencies":  [
                            "@solidcx/styles"
                        ]
}