{
    "$schema":  "../component.schema.json",
    "name":  "calendar",
    "type":  "registry:ui",
    "title":  "Calendar",
    "description":  "A reusable Calendar component for SolidJS applications.",
    "files":  [
                  {
                      "path":  "packages/ui/src/components/calendar/calendar.scss",
                      "type":  "style"
                  },
                  {
                      "path":  "packages/ui/src/components/calendar/Calendar.tsx",
                      "type":  "component"
                  },
                  {
                      "path":  "packages/ui/src/components/calendar/index.ts",
                      "type":  "barrel"
                  }
              ],
    "dependencies":  [
                         "@solidcx/cx",
                         "lucide-solid"
                     ],
    "registryDependencies":  [

                             ],
    "cssDependencies":  [
                            "@solidcx/styles"
                        ]
}